{
  "$schema": "https://json-schema.org/draft/2020-12/schema",
  "$id": "careeros/video_type",
  "type": "object",
  "additionalProperties": false,
  "required": ["schema", "id", "label", "description", "version", "entry_points", "subject", "writer", "skill", "voice_type", "length", "scene_types", "sources", "brief_template", "rules", "facts", "output", "media"],
  "properties": {
    "schema": { "const": 1 },
    "id": { "type": "string", "pattern": "^[a-z0-9]+(-[a-z0-9]+)*$", "maxLength": 40 },
    "label": { "type": "string", "minLength": 1, "maxLength": 60 },
    "description": { "type": "string", "maxLength": 300 },
    "version": { "type": "integer", "minimum": 1 },
    "entry_points": { "type": "array", "minItems": 1, "uniqueItems": true, "items": { "enum": ["job", "job.gaps", "job.interview", "company", "apply.review", "learn.topic", "home", "chat"] } },
    "subject": { "enum": ["job", "company", "topic", "week"] },
    "writer": { "enum": ["claude", "template"] },
    "skill": { "enum": ["video-explainer", "video-slides"] },
    "voice_type": { "enum": ["guide", "interview", "slides"] },
    "length": {
      "type": "object", "additionalProperties": false, "required": ["min_s", "target_s", "max_s"],
      "properties": {
        "min_s": { "type": "integer", "minimum": 10, "maximum": 600 },
        "target_s": { "type": "integer", "minimum": 10, "maximum": 600 },
        "max_s": { "type": "integer", "minimum": 10, "maximum": 600 }
      }
    },
    "scene_types": {
      "type": "array", "minItems": 1, "uniqueItems": true,
      "items": { "enum": ["title", "bullet-build", "code-typing", "code-highlight", "code-morph", "code-diff", "flowchart", "sequence", "comparison", "stat", "quiz", "recap-card", "icon-grid", "logo-row", "diagram", "match", "checklist", "timeline", "chart", "quote", "company-card", "map-pin", "kinetic", "matrix"] }
    },
    "scene_counts": {
      "type": "object", "default": {},
      "propertyNames": { "enum": ["title", "bullet-build", "code-typing", "code-highlight", "code-morph", "code-diff", "flowchart", "sequence", "comparison", "stat", "quiz", "recap-card", "icon-grid", "logo-row", "diagram", "match", "checklist", "timeline", "chart", "quote", "company-card", "map-pin", "kinetic", "matrix"] },
      "additionalProperties": {
        "type": "object", "additionalProperties": false, "required": ["min", "max"],
        "properties": { "min": { "type": "integer", "minimum": 0, "maximum": 12 }, "max": { "type": "integer", "minimum": 1, "maximum": 12 } }
      }
    },
    "sources": {
      "type": "array", "maxItems": 12,
      "items": {
        "type": "object", "additionalProperties": false, "required": ["resolver", "required"],
        "properties": {
          "resolver": { "enum": ["gap", "job.jd", "job.must_haves", "job.score", "history", "profile", "company.research", "company.record", "interview.questions", "application.files", "index.stats", "learning.guide"] },
          "required": { "type": "boolean" },
          "glob": { "type": "string", "pattern": "^[A-Za-z0-9_*-][A-Za-z0-9_.*-]*$", "maxLength": 40 }
        }
      }
    },
    "brief_template": { "type": "string", "minLength": 1, "maxLength": 400 },
    "rules": { "type": "array", "maxItems": 20, "items": { "type": "string", "minLength": 1, "maxLength": 300 } },
    "facts": { "enum": ["strict", "teaching"] },
    "extras": { "type": "array", "default": [], "maxItems": 4, "uniqueItems": true, "items": { "type": "string", "pattern": "^[a-z0-9]+(-[a-z0-9]+)*\\.md$", "maxLength": 40 } },
    "output": { "type": "string", "maxLength": 120, "pattern": "^(companies/\\{slug\\}/(jobs/\\{id\\}/)?|learning/\\{topic\\}/|recaps/)([a-z0-9{}_-]+/){1,3}$" },
    "media": { "enum": ["none", "offline", "free"] },
    "modes": { "type": "array", "default": [], "uniqueItems": true, "items": { "enum": ["practice", "watch"] } },
    "custom": { "type": "object", "default": {} }
  }
}
