{
  "schema": 1,
  "id": "jd-walkthrough",
  "label": "JD walkthrough",
  "description": "What the role really asks for: must-haves against nice-to-haves, how your evidence maps, and the gaps named as gaps.",
  "version": 2,
  "entry_points": ["job"],
  "subject": "job",
  "writer": "claude",
  "skill": "video-slides",
  "voice_type": "slides",
  "length": { "min_s": 30, "target_s": 150, "max_s": 600 },
  "scene_types": ["title", "comparison", "bullet-build", "stat", "flowchart", "recap-card", "sequence", "icon-grid", "logo-row", "diagram", "match", "checklist", "timeline", "chart", "quote", "company-card", "map-pin", "kinetic", "matrix"],
  "scene_counts": { "title": { "min": 1, "max": 1 }, "comparison": { "min": 0, "max": 3 }, "recap-card": { "min": 0, "max": 1 }, "match": { "min": 0, "max": 3 } },
  "sources": [
    { "resolver": "job.jd", "required": true },
    { "resolver": "job.must_haves", "required": true },
    { "resolver": "job.score", "required": false },
    { "resolver": "history", "required": false }
  ],
  "brief_template": "This recap tells {name} what {company} really asks for in the {role} role, before they apply.",
  "rules": [
    "Separate must-haves from nice-to-haves.",
    "Show the role's asks against the candidate's evidence with a match scene (each ask marked match, partial or gap). Every match row about the candidate cites me/history.",
    "Name every gap as a gap. Never claim evidence that is not in me/history.",
    "Show technologies as a logo-row or icon-grid, systems as a diagram, the location as a map-pin. Keep sentences for the narration.",
    "Write notes.md with one section per slide."
  ],
  "facts": "strict",
  "extras": ["notes.md"],
  "output": "companies/{slug}/jobs/{id}/videos/jd-walkthrough-{n}/",
  "media": "offline",
  "modes": []
}
