{
  "schema": 1,
  "id": "application-summary",
  "label": "Application summary",
  "description": "What you are about to send and why it fits, from the application files and the job ad only.",
  "version": 2,
  "entry_points": ["apply.review"],
  "subject": "job",
  "writer": "claude",
  "skill": "video-slides",
  "voice_type": "slides",
  "length": { "min_s": 30, "target_s": 60, "max_s": 180 },
  "scene_types": ["title", "comparison", "bullet-build", "recap-card", "match", "checklist", "timeline", "icon-grid", "logo-row", "kinetic", "quote"],
  "scene_counts": { "title": { "min": 1, "max": 1 }, "recap-card": { "min": 1, "max": 1 } },
  "sources": [
    { "resolver": "application.files", "required": true },
    { "resolver": "job.jd", "required": true },
    { "resolver": "job.score", "required": false }
  ],
  "brief_template": "This summary shows {name} what their application to {company} for {role} says, before they approve it.",
  "rules": [
    "Use only what is in the application files and the job ad.",
    "Show what is being sent and the strongest reasons it fits.",
    "If a must-have is not covered by the application, say so."
  ],
  "facts": "strict",
  "extras": [],
  "output": "companies/{slug}/jobs/{id}/application/summary-video/",
  "media": "none",
  "modes": []
}
